2020_01_03_0	US kills Iran’s most powerful general in Baghdad airstrike
2020_01_03_1	Lebanon receives Interpol arrest warrant for ex-Nissan boss Ghosn
2020_01_03_2	Oil prices jump after U.S. air strike kills top Iranian commander
2020_01_03_3	U.S. farmers see another bleak year despite Phase 1 trade deal
2020_01_03_4	Israel defends U.S. killing of Iranian commander, puts military on alert
2020_01_03_5	Ryanair CEO says group may not get 737 MAX until October: report
2020_01_03_6	Trump seeks to shore up evangelical support at 'prosperity gospel' church
2020_01_03_7	Conservative, liberal Methodists to split over gay marriage
2020_01_03_8	Giuliani associate can give documents sought in Trump impeachment to House panel
2020_01_03_9	Trump says ordered killing of Iranian general to prevent war, not start one
2020_01_03_10	Former Mexico security chief tied to Sinaloa cartel pleads not guilty in NY
2020_07_18_0	U.S. swoops down on Portland protesters after Trump order to protect monuments
2020_07_18_1	Australia PM delays parliament as coronavirus spreads
2020_07_18_2	Iran has sent black boxes of downed plane to France: official
2020_07_18_3	Russia holds military exercises in southwest amid flare-up between Azerbaijan and Armenia
2020_07_18_4	G20 finance officials eye solution to digital tax row this year
2020_08_25_0	Facebook blocks group critical of Thai monarchy amid government pressure
2020_08_25_1	Wisconsin calls out National Guard after unrest over police shooting of Black man
2020_08_25_2	Merkel tells Russia to investigate suspected poisoning of Kremlin critic
2020_08_25_3	Belarus jails two opposition leaders; teachers head rally of thousands
2020_08_25_4	Coronavirus re-infections raise concerns about immunity
2020_08_25_5	Sudan PM tells Pompeo he's not authorised to normalise ties with Israel
2020_08_25_6	Former Bosnian Serb general Mladic appeals genocide conviction
2020_08_25_7	Three killed, 41 wounded in Taliban truck bomb in Afghanistan
2020_08_25_8	In California heatwave, pandemic makes it hard to cool off
2020_08_25_9	Germany urges Turkish-Greek talks to avoid 'catastrophe'
2020_08_25_10	Iran's Rouhani: Talks possible if U.S. returns to 2015 nuclear deal
2020_08_25_11	U.S. slams Turkey's Erdogan for hosting Hamas
2020_08_25_12	U.N. Security Council president dismisses U.S. sanctions move on Iran
2020_08_25_13	U.S. imposes sanctions on Chinese national over fentanyl trafficking
2020_08_25_14	U.S. backs EU probe of Russian opposition leader's illness - Pompeo
2020_08_25_15	Israeli delegation to visit UAE next week, accompanied by Trump aides
2020_10_01_0	American Islamic State supporters held by Kurds back in U.S. custody: DOJ
2020_10_01_1	Top U.S. airlines starting 32,000 furloughs as bailout hopes fade
2020_10_01_2	Exclusive: FDA widens U.S. safety inquiry into AstraZeneca coronavirus vaccine - sources
2020_10_01_3	Trump signs stopgap bill to avoid U.S. government shutdown
2020_10_01_4	France, Russia, U.S. demand immediate end to Nagorno-Karabakh hostilities
2020_10_01_5	Google to pay publishers $1 billion over three years for their news
2020_10_01_6	New York Catholic diocese files for bankruptcy to cover abuse lawsuit costs
2020_10_19_0	China's Ant wins Hong Kong nod for $35 billion dual listing: sources
2020_10_19_1	On Suga's overseas debut, Japan, Vietnam agree broadly on defence transfer
2020_10_19_2	Thai police probe media, as thousands again defy protest ban
2020_10_19_3	India says Chinese soldier apprehended in Ladakh, to be returned
2020_08_01_0	Trump says he will ban TikTok app in the United States
2020_08_01_1	Iran says it has detained U.S.-based opposition leader over 2008 bomb attack
2020_08_01_2	Thousands march in Berlin against coronavirus curbs
2020_08_01_3	Kenya Airways resumes international flights after virus curbs lifted
2020_08_01_4	Bass addresses past remarks praising Scientology
2020_06_06_0	Biden wins enough delegates to clinch U.S. Democratic nomination
2020_09_21_0	Explainer: U.S. says U.N. sanctions on Iran have now been reimposed. What does that mean?
2020_09_21_1	Suspect arrested in connection with ricin letter addressed to White House
2020_09_21_2	Greece says it's close to resuming maritime talks with Turkey
2020_09_21_3	India's Modi defends new law as critics warn of risks to farmers
2020_09_21_4	Israeli court approves extradition to Australia of sex-crime suspect
2020_09_21_5	Belarus opposition appeal to EU fails to unblock sanctions
2020_09_21_6	Europe scrambles to contain rise in coronavirus cases
2020_09_21_7	Russia rejects U.S. terms, sees 'minimal' chance to extend New START nuclear pact
2020_09_21_9	Justice Ginsburg to be honoured at U.S. Supreme Court, Capitol
2020_09_21_10	U.S. charges New York City police officer with acting as illegal agent of China
2020_02_18_0	Federal, B.C. ministers seek meeting with Wet’suwet’en in hope of blockade solution – Kelowna Capital News
2020_02_18_1	Colombia tells Facebook to boost security for users' data
2020_02_18_2	Hospital director dies in China's Wuhan, epicentre of coronavirus outbreak
2020_02_18_3	Turkey ramps up Gulen crackdown with nearly 700 arrests
2020_02_18_4	Thai police arrest gunman for killing ex-wife at shopping mall
2020_02_18_5	Turkey issues fresh detention request after surprise acquittal in protest trial
2020_02_18_6	Bloomberg qualifies for next debate after poll boost
2020_02_18_7	Russian artist under investigation over French sexting row
2020_02_18_8	Ghani named winner of disputed Afghan poll, rival also claims victory
2020_02_18_9	Netanyahu's trial to begin on March 17: Israeli Justice Ministry
2020_02_18_10	Russia bars entry of Chinese citizens amid coronavirus threat
2020_04_09_0	Sanders quits U.S. presidential race, setting up Biden battle with Trump
2020_04_09_1	Saudi, Russia outline record oil cut under U.S. pressure as demand crashes
2020_04_09_2	Saudi-led coalition announces ceasefire in five-year Yemen war
2020_04_09_3	Australian police take 'black box' off cruise ship in coronavirus homicide probe
2020_04_09_4	Exclusive: U.S. ambassador to South Korea is discussing plans to resign - sources
2020_04_09_5	Rockets hit U.S. air base in Afghanistan; no casualties
2020_04_09_6	EU ministers agree half a trillion euro coronavirus rescue plan
2020_04_09_7	Pfizer says early studies of potential coronavirus treatment show promise
2020_07_10_0	U.S. bans Pakistan International Airlines flights over pilot concerns
2020_07_10_1	North Korean leader's sister says another summit unlikely but ”a surprise thing may still happen”
2020_07_10_2	China should meet with U.S. on arms control, State Department says
2020_07_10_3	Botswana gets first test results on elephant deaths
2020_07_10_4	UPDATE 1-Tropical Storm Fay brings drenching rainfall to U.S. Northeast
2020_07_10_5	Speak quietly and follow the rules, Tokyo nightclubs told as coronavirus re-emerges
2020_07_10_6	Hong Kong to suspend all schools due to spike in coronavirus cases
2020_07_10_7	Swedish court finds ex-envoy to China not guilty in Gui Minhai case
2020_07_10_8	Police dismantle a makeshift shelter camp in Calais
2020_07_10_9	Dutch government to file suit against Russia over downing of MH17
2020_07_10_10	Erdogan declares Hagia Sophia a mosque after Turkish court ruling
2020_07_10_11	Mexican president thanks Trump for not mentioning border wall at summit
2020_07_10_12	Trump says he is not thinking about a 'Phase 2' U.S. - China trade deal
2020_07_10_13	Mali's state television ORTM goes off-air after protesters occupy building
2020_07_10_14	Amazon.com bans, then un-bans TikTok app from employee mobile devices
2020_07_10_15	Prosecutors may not get Trump tax records until after election, experts say
2020_01_05_0	Trump says U.S. would hit 52 Iranian sites if American targets attacked
2020_01_05_1	White House gives lawmakers formal notice of Iraq strike amid complaints from Democrats
2020_01_05_2	China replaces head of Hong Kong liaison office amid ongoing protests
2020_01_05_3	Blowback: Iran abandons nuclear limits after US killing
2020_01_05_4	Three Americans killed in al Shabaab militant attack on base in Kenya
2020_01_05_5	Man killed in fatal shark attack in Australia
2020_01_05_6	Dozens arrested after Hong Kong protest taking aim at Chinese traders
2020_01_05_7	U.S.-led coalition pauses training and support for Iraqi security forces -statement
2020_01_05_8	Hezbollah chief: U.S. will ‘pay the price’ for Soleimani’s killing
2020_01_05_9	Venezuela's ruling Socialists seize congress, defiant opposition re-elects Guaido
2020_08_14_0	U.S. says Ghislaine Maxwell was isolated in jail for her safety
2020_08_14_1	Trump holds up coronavirus aid to block funding for mail-in voting
2020_08_14_2	Trump says he plans to give convention speech from White House lawn: New York Post interview
2020_08_14_3	Exclusive: ByteDance censored anti-China content in Indonesia until mid-2020, sources say
2020_08_14_4	Southern California wildfire forces evacuation of hundreds of homes
2020_08_14_5	UAE's Israel deal met with Arab dismay but quiet welcome in Gulf
2020_08_14_6	Stocks dip on lukewarm data; oil falls
2020_08_14_7	U.N. Security Council starts Iran arms embargo vote, result Friday
2020_08_14_8	Paris, Marseille named as high-risk COVID zones, making curbs likelier
2020_08_14_9	Britons rush home from France to beat new quarantine rules
2020_08_14_10	Turkey may suspend ties with UAE over Israel deal, Erdogan says
2020_08_14_11	Poland offers new support for Belarus civil society, media
2020_08_14_13	Postal union endorses Biden candidacy as 'survival' of USPS at stake
2020_08_14_14	Spain deplores continued U.S. tariffs on EU goods: minister
2019_12_21_0	Russia gas export pipeline in jeopardy as Trump signs sanctions bill
2019_12_21_1	Iran's Rouhani welcomes Japan opt-out of U.S.-led naval mission in Gulf
2020_12_16_0	U.S. condemns abduction of Nigeria schoolboys, looking into Boko Haram claim of responsibility
2020_12_16_1	Lawyer: Family to release autopsy of Black man killed by cop
2020_12_16_2	BAT's COVID-19 vaccine candidate gets U.S. approval for human trials
2020_12_16_3	Minnesota frees man sentenced to life for 2002 murder
2020_12_16_4	EU chief says UK trade pact closer but success not certain
2020_12_16_5	Iran leaders: Biden arrival won’t guarantee better relations
2020_12_16_6	Boeing grants vested shares to some employees, halts merit pay raises
2020_12_16_7	Canada PM hopes for good news soon about fate of two detainees in China
2020_12_16_8	U.S. charges Kenyan militant with researching 9/11-style airplane hijacking
2020_03_10_0	Oil jumps 8% on stimulus hopes, spending cuts by U.S. producers
2020_03_10_1	Taliban prepare for Afghan president to order prisoner swap
2020_03_10_2	Xi visits Wuhan, signaling tide turning in China's coronavirus battle
2020_03_10_3	Czech prime minister says China's ambassador should be replaced
2020_03_10_4	British PM Johnson defeats lawmaker revolt on Huawei's 5G role
2020_03_10_5	Dutch king apologizes for 'excessive violence' in colonial Indonesia
2020_03_10_6	White House says Trump, Saudi crown prince discussed energy markets
2020_03_10_7	In setback for Trump, court says House panel can get Russia report material
2020_03_10_8	New York to close schools, houses of worship in suburban center of coronavirus outbreak
2020_03_10_9	Bernie Sanders cancels Cleveland rally over coronavirus concerns
2020_02_16_0	Yemen's air strikes 'kill 31 civilians' after Saudi jet crash
2020_02_16_1	Rockets strike near U.S. Embassy in Baghdad
2020_02_16_2	Taiwan's confirms first coronavirus death on island, cases at 20
2020_02_16_3	Former DOJ officials call on Attorney General Barr to resign
2020_04_01_0	Oil ends lower after U.S. crude stockpiles jump, gasoline demand sinks
2020_04_01_1	European experts ready smartphone technology to help stop coronavirus
2020_04_01_2	Putin takes coronavirus precautions as Moscow unveils tracking app
2020_04_01_3	Trump warns Iran against possible 'sneak attack' on U.S. in Iraq
2020_01_23_0	Canadian prosecutor set to defend U.S. request to extradite Huawei CFO Meng
2020_01_23_1	World Court orders Myanmar to protect Rohingya from acts of genocide
2020_01_23_2	Canadian waterbomber plane crashes while fighting Australia bushfires, three dead
2020_01_23_3	Successor to slain Iran general faces same fate if he kills Americans: U.S. envoy
2020_01_23_4	Turkish foreign minister says Russian S-400 air defense no threat to NATO
2020_01_23_5	Actress Annabella Sciorra testifies she tried to fight Weinstein during alleged rape
2020_01_23_6	U.S. bank regulator charges ex-Wells Fargo executives for role in sales scandal
2020_01_23_7	Trump to unveil long-stalled Middle East peace plan ahead of Israeli leaders' visit
2020_04_04_0	U.S. attorney general orders release of more federal inmates due to coronavirus pandemic
2020_04_04_1	'He's a total disgrace': Trump defends firing U.S. intel watchdog
2020_09_29_0	In reversal, Kentucky prosecutor to release Breonna Taylor grand jury evidence
2020_09_29_1	Multiple deaths in reported Oregon hostage standoff
2020_09_29_2	Slain S.Korean man tried to defect to N.Korea -Coast Guard
2020_09_29_3	Armenia reports first death on its soil after Azeri shelling
2020_09_29_4	Amnesty halts India operations, saying it is being silenced
2020_09_29_5	In Vilnius, Macron meets exiled Belarus opposition leader
2020_09_29_6	Pompeo urges Greece, Turkey to pursue talks on maritime dispute
2020_09_29_7	Nokia wins 5G radio equipment contract from Britain's BT
2020_09_29_8	Turkey denies claim that it shot down an Armenian warplane
2020_09_29_9	Defense attorney tells U.S. court she asked Trump not to pardon Michael Flynn
2020_09_29_10	Israel's Netanyahu urges Beirut neighborhood to 'act now' on alleged Hezbollah arms depot
2020_09_29_11	Schiff subpoenas DHS over whistleblower complaint
2020_10_11_0	Israel would oppose any U.S. F-35 sale to Qatar, Israeli minister says
2020_10_11_1	Britain tells Germany gaps in EU talks must be closed soon
2020_01_30_0	Policymakers fret over risk to global growth from China virus outbreak
2020_01_30_1	Pompeo backs 'Five Eyes' intelligence sharing despite UK decision on Huawei
2020_01_30_2	Wilbur Ross says coronavirus could bring jobs back to the U.S. from China
2020_03_02_0	Netanyahu set to declare narrow victory in Israeli election: party spokesman
2020_03_02_1	Child drowns at sea off Greece in first fatality after Turkey opens border
2020_03_02_2	Syrian government forces re-enter strategic town, Turkey vows to keep up strikes
2020_03_02_3	China urges authorities to prepare for possible locust invasion
2020_03_02_4	United Nations Libya envoy resigns citing stress
2020_03_02_5	IMF, World Bank say ready to address economic challenges of coronavirus
2020_03_02_6	Pentagon lays out Afghanistan withdrawal plans after Taliban accord
2020_03_02_7	Ron Johnson threatens subpoena over Hunter Biden's Ukraine work
2020_08_02_0	Brazil's Eletrobras to invest $1 billion a year through 2035
2020_05_08_0	One person dead after being struck by plane landing at airport in Austin, Texas
2020_01_12_0	Australian PM proposes high-powered inquiry into bushfires response
2020_07_17_0	End of the jumbo: British Airways retires 747 early due to coronavirus crisis
2020_07_17_1	Hong Kong demands Taiwan officials sign 'one China' document for visa renewal - source
2020_07_17_2	Biden facing pressure within party as running mate search enters final phase
2020_07_17_3	Ryanair plane lands safely in Oslo after bomb threat, no explosives found
2020_07_17_4	Italy plans listing for Autostrade by early 2021: sources
2020_02_28_0	Turkey says will not stop Syrian refugees reaching Europe after troops killed
2020_02_28_1	Turkey says it will let refugees into Europe after its troops killed in Syria
2020_02_28_2	New Zealand confirms first case of the new coronavirus
2020_02_28_3	Italian with coronavirus in Nigeria was not isolated for almost 48 hours
2020_02_28_4	Greece tightens border with Turkey as migrants approach
2020_02_28_5	First British national dies from coronavirus in Japan
2020_02_28_6	Mexico confirms three coronavirus cases in three men returned from Italy
2020_02_28_7	Trump, in call with Erdogan, backs Turkey and urges end to violence in Syria's Idlib
2020_08_17_0	At least seven dead after gunmen attack Mogadishu hotel
2020_08_17_1	On eve of Hariri verdict, Lebanese grapple with new ordeal
2020_08_17_2	'I'm not a saint': Lukashenko offers to hand over power after referendum
2020_08_17_3	Pakistani army chief visits Saudi Arabia to revive ties strained over Kashmir
2020_08_17_4	U.S. tightening restrictions on Huawei access to technology, chips
2020_08_17_5	U.S. won't approve Israeli annexations for 'some time', Kushner says
2020_08_17_6	Two charged with 2002 New York murder 'in cold blood' of rapper Jam Master Jay
2020_08_08_0	UK armed forces asked to help deal with migrant boats crossing Channel
2020_08_08_1	DeWine tests negative after positive test before Trump visit
2020_08_08_2	'America's toughest sheriff' narrowly defeated in bid for old job
2020_10_14_2	Old foes Lebanon, Israel hold talks on disputed maritime border
2020_10_14_3	Nagorno-Karabakh ceasefire hopes sink as warring sides bicker and fight
2020_10_14_4	Eli Lilly says other COVID-19 antibody drug trials ongoing after study halted for safety concern
2020_10_14_5	Britain's spies defending COVID-19 vaccine work, MI5 chief says
2020_10_14_6	U.S. pleased Iraq doing more to protect U.S. embassy - Pompeo
2020_01_02_0	Hundreds arrested in Hong Kong in New Year's Day protests: police
2020_01_02_1	Five fishermen presumed dead in sinking of Alaska crabbing vessel
2020_01_02_2	Turkish lawmakers authorize sending troops to fight in Libya
2020_01_02_3	Taiwan's military chief among eight dead in helicopter crash
2020_01_02_4	Lebanon receives Interpol notice for ex-Nissan fugitive
2020_01_02_5	Popular Iowa congresswoman endorses Joe Biden for president
2020_01_02_6	'It simply isn’t our time': Julián Castro ends presidential bid
2020_01_02_7	Officer who drunkenly broke into Nashville home quits NYPD
2020_09_24_0	North Korean troops killed missing South Korean official, burned body, Seoul says
2020_09_24_1	Breonna Taylor's family demands to see Kentucky grand jury evidence
2020_09_24_2	Australia's Westpac agrees to $920 million fine over exploitation payments
2020_09_24_3	Japan's new PM calls for better ties with South Korea, cooperation on North Korea
2020_09_24_4	UK preparing Magnitsky sanctions over Belarus human rights violations: minister
2020_09_24_5	U.S. imposes new Iran sanctions over human rights violations
2020_09_24_6	Trump deserves 'fair chance' to challenge subpoena for tax returns: filing
2020_09_24_7	Judge says U.S. must defend or delay TikTok app store ban by Friday
2020_03_07_0	Saudi Arabia detains senior royals for alleged coup plot, including king's brother -sources
2020_03_07_1	Turkey says ceasefire holds in Syria's Idlib, Russia reports some shootings
2020_03_07_2	Six years on, families demand new search for missing Malaysia Airlines plane
2020_03_07_3	Declaring it cannot pay debts, Lebanon sets stage for default
2020_05_05_0	Taiwan rebuffs WHO, says China has no right to represent it
2020_05_05_1	Senators question Trump pick for top U.S. spy in 'different' hearing
2020_12_26_0	Motor home explodes in Nashville, possible human remains found near site
2020_12_26_1	Nashville blast investigation leads U.S. agents to suburban home
2020_12_26_2	First case of new COVID variant found in France as cases rise
2020_12_26_3	Virus besets Belarus prisons filled with president’s critics
2020_12_26_4	Germany, Hungary give 1st vaccine shots ahead of EU rollout
2020_12_26_5	Netanyahu expects ties visit by Morocco to Israel next week
2021_01_08_0	Boeing to pay $2.5 billion to settle U.S. criminal probe into 737 MAX crashes
2021_01_08_2	House Speaker Pelosi says she spoke to top U.S. general about restraining Trump
2021_01_08_3	Tokyo angered after S.Korea court orders Japan to compensate 'comfort women'
2021_01_08_4	Pfizer/BioNTech vaccine appears effective against mutation in new coronavirus variants -study
2021_01_08_6	Canada's Trudeau says Trump, other politicians incited Capitol Hill violence
2020_09_10_0	U.S. cancels visas of more than 1,000 Chinese nationals deemed security risks
2020_09_10_1	Australia's government squabbles with states over easing restrictions as virus cases decline
2020_09_10_2	Europe's south tells Turkey: resume talks this month or risk sanctions
2020_09_10_3	U.S. set to end enhanced screening of some international travelers for COVID-19: sources
2020_09_10_4	‘I want to be in the Trump party’: GOP rides voter registration surge in key state
2020_09_10_5	Exclusive: Microsoft believes Russians that hacked Clinton targeted Biden campaign firm - sources
2020_09_10_6	Pompeo tells Southeast Asia to stand up to China, shun its firms
2020_09_10_7	Huge blaze at Beirut port alarms residents a month after massive blast
2020_09_10_8	Citigroup's Fraser to be first woman CEO of Wall Street bank
2020_09_10_9	Prisoners sought by Taliban on flight to Doha, peace talks this weekend
2020_09_10_10	Czech PM vetoes V4 meeting with Belarus opposition leader
2020_09_10_11	UPDATE 3-U.S. cites Smithfield Foods for failing to protect workers from coronavirus
2020_07_09_0	Facebook suspends disinformation network tied to staff of Brazil's Bolsonaro
2020_07_09_1	U.S. sees importance of North Korea talks despite tension, officials say
2020_07_09_2	U.S. first lady Melania Trump statue set on fire in Slovenia
2020_07_09_3	Angering China, Australia suspends extradition treaty with Hong Kong, extends visas
2020_07_09_4	Ousted U.S. prosecutor says Barr pressed him to resign
2020_07_09_5	U.S. Supreme Court rebuffs Trump's immunity claim, lets prosecutor get financial records
2020_07_09_6	Seoul mayor found dead after leaving message 'like a will'
2020_07_09_7	Sudan replaces slew of top ministers to speed political reforms
2020_07_09_8	U.S. Supreme Court deems half of Oklahoma a Native American reservation
2020_07_09_9	Brazil bans fires in Amazon rainforest as investors demand results
2020_07_09_10	Man who planned to attack London gay pride march jailed for life
2020_07_09_11	Ex-Trump lawyer behind bars again after dispute over gag order
2020_07_09_12	Ireland's Donohoe takes Eurogroup helm during worst recession
2020_07_09_13	U.S. judge hearing Flynn case asks appeals court to reconsider dismissal
2021_01_03_0	Two French soldiers killed during mission in Mali
2021_01_03_1	Niger village attacks killed 100, says prime minister
2021_01_03_2	Islamic State claims responsibility for attack on Pakistan's Shi'ite Hazara minority that kills 11
2021_01_03_3	The Latest: Nancy Pelosi reelected speaker of the House
2021_01_03_4	Sheriff: Pastor dead, 2 hurt in shooting at Texas church
2020_12_27_0	UN: Libya’s rivals swap prisoners, part of cease-fire deal
2020_12_27_1	‘Believe in science’: EU kicks off COVID-19 vaccine campaign
2020_12_27_2	China pushes Ant Group overhaul in latest crackdown on Ma
2020_02_21_0	Stone sentenced to three years and four months, Trump signals no immediate pardon for adviser
2020_02_21_1	Prime minister leaves Lesotho, avoids being charged with murdering wife
2020_02_21_2	Summit standoff as EU leaders grapple with Brexit-sized hole in budget
2020_02_21_3	Sanders blasts Russia for reportedly trying to boost his presidential campaign
2020_02_21_4	Coronavirus widens Hong Kong anger at government, China
2020_02_21_5	U.S., Taliban plan to sign accord after planned week-long 'reduction in violence'
2020_02_21_6	'Traumatised' Africans stranded by coronavirus plead to be brought home
2020_02_21_7	Israel says cruise passenger flown home from Japan has virus
2020_02_21_8	Moscow deploys facial recognition technology for coronavirus quarantine
2020_02_21_9	Trump: U.S. may give farmers more aid until trade deals 'kick in'
2020_02_21_10	Wells Fargo to pay $3 billion to U.S., admits pressuring workers in fake-accounts scandal
2020_09_12_0	Afghan peace talks open with calls for ceasefire, women's rights
2020_09_12_1	Venezuela says 'U.S. spy' captured near oil refinery complex
2020_09_12_2	Trump officials interfered with CDC reports on Covid-19
2020_09_12_3	Families of captured Hong Kong activists demand their return
2020_09_12_4	Iranian wrestler Navid Afkari executed over 2018 security guard killing
2020_09_12_5	AstraZeneca resumes UK trials of COVID-19 vaccine halted by patient illness
2020_04_05_0	United Airlines cutting flights at LaGuardia, Newark
2020_04_05_1	Premier infuriated by Trump, says Canada helped US amid 9/11
2020_04_05_2	Boris Johnson hospitalised for tests after persistent coronavirus symptoms
2020_07_04_0	Kim Guilfoyle, campaign official and girlfriend of Trump Jr., tests positive for coronavirus in South Dakota
2020_07_04_1	U.S. sends carriers to South China Sea during Chinese drills
2020_07_04_2	Hong Kong officials disappointed at Canada's move to suspend extradition pact
2020_07_04_3	North Korea says no need to sit down with U.S. for talks
2020_05_06_0	EU offers more aid, membership to Balkans in riposte to China, Russia
2020_05_06_1	Judge reinstates New York’s Democratic presidential primary
2020_05_06_2	New coronavirus spread swiftly around world from late 2019, study finds
2020_05_06_3	U.S. Supreme Court Justice Ginsburg recovering after gallbladder treatment
2020_05_06_4	South Korea spy agency says no signs North Korea's Kim received heart surgery
2020_05_06_5	Rockets hit near Baghdad airport, launcher with timer found
2020_05_06_6	Israeli billionaire hopes to bring water to parched Gaza
2020_05_06_7	Israel's Supreme Court clears Netanyahu to form government despite corruption charges
2020_05_06_8	Trump vetoes Iran war powers resolution
2020_01_24_0	Trump to unveil long-stalled Middle East peace plan ahead of Israeli leaders' visit
2020_01_24_1	Texas student who traveled to China being tested for possible coronavirus
