2020_09_04_8	EU to hone 'carrot and stick' line on Turkey at summit, top official says
2020_09_04_9	Lawmakers set dates for public input on coronavirus relief
2020_09_04_10	Trump lauds economic steps between Serbia and Kosovo
2020_09_04_11	Libyan families file U.S. lawsuit accusing LNA leader Haftar of war crimes
2020_09_04_12	Authorities: Man killed landlord, then called 911
2020_09_04_13	El Salvador prosecutor says he will investigate allegations of government pacts with gangs
2020_09_04_14	Trump security adviser says China has biggest election-interference program
2020_09_04_15	After criticism, Trump says Pentagon will not shut down Stars and Stripes
2020_09_04_16	Jacob Blake pleads not guilty to charges prior to Kenosha shooting
2020_01_10_0	Iran invites Boeing to probe plane crash that killed 176 – Kelowna Capital News
2020_01_10_1	U.S. House passes resolution to limit Trump's ability to wage war on Iran
2020_01_10_2	Suspected jihadists strike Niger military; 25 soldiers dead
2020_01_10_3	Washington spurns Iraqi call to remove troops
2020_01_10_4	'Designed by clowns': Boeing employees ridicule 737 MAX, regulators in internal messages
2020_01_10_5	Trump sends North Korea's Kim birthday greetings
2020_01_10_6	U.S. targeted Iranian official in Yemen in failed strike - sources
2020_01_10_7	Trump, red states ask Supreme Court to refuse Obamacare case before election
2020_06_27_0	Attorney General Barr forms panel on 'anti-government extremism'
2020_06_27_1	Sudan, Egypt say Ethiopia will not fill Nile dam without reaching deal
2020_06_27_2	UK ditches quarantine for arrivals from low COVID-19 risk countries
2020_06_27_3	Police: Baby girl dies in Virginia after being left in car
2020_03_19_0	Muslim event in Indonesia stopped amid coronavirus fears
2020_03_19_1	China reports no new local coronavirus transmissions for first time
2020_03_19_2	U.S. oil reverses losses, posts largest one-day gain on record
2020_03_19_3	Tesla suspends production at U.S. vehicle factory due to coronavirus
2020_03_19_4	U.S. Representative Tulsi Gabbard ends Democratic presidential bid, endorses Biden
2020_03_19_5	Pompeo says U.S. citizen detained in Iran since 2018 released on medical furlough
2020_03_19_6	Exclusive: Ferrari and Fiat look at helping Italy make ventilators in coronavirus crisis
2020_03_19_7	Turkey says two soldiers killed in Syria's Idlib in attack by 'radical groups'
2020_07_05_0	Sheriff: 2 dead, 8 hurt in South Carolina nightclub shooting
2020_07_05_1	Russian shot dead in Austria, police probe political motive
2020_07_05_2	Too soon to say if safe to hold Republican convention in Florida, U.S. official says
2020_06_30_0	Facing criticism, White House to brief Democrats on reports Russia paid Taliban to kill U.S. troops
2020_06_30_1	China passes national security law in turning point for Hong Kong
2020_06_30_2	Saudi, U.S. officials call for extending UN arms embargo on Iran
2020_06_30_3	India's Chinese app ban seen jolting ByteDance's India plans, angers some TikTok users
2020_06_30_4	Belgian king expresses deep regret for colonial past in Congo
2020_06_30_5	Sahel summit agrees need to intensify campaign against jihadists
2020_06_30_6	Judge temporarily halts release of tell-all book by Donald Trump's niece
2020_06_30_7	EU condemns envoy expulsion from Venezuela, warns of isolation
2020_06_30_8	Mexican labour activist's arrest sends 'wrong signal' under North America trade deal
2019_12_15_1	Major states snub calls for climate action as U.N. summit wraps up
2020_05_31_0	Trump postpones G7 summit, seeks to add countries to invitation list
2020_05_31_1	SpaceX Crew Dragon delivers two NASA astronauts to International Space Station
2020_05_31_2	China media, Hong Kong government bristle at Trump's pledge of curbs, sanctions
2020_09_16_0	Louisville to pay $12 million settlement over Breonna Taylor's death in botched police raid
2020_09_16_1	Hurricane Sally takes aim at U.S. Alabama-Florida border area
2020_09_16_2	'Europe's moment': EU chief calls for unity to confront crises
2020_09_16_3	Bundesbank chief defends ECB bond purchases in wake of court case
2020_09_16_4	Boeing, FAA failures to blame for 737 MAX crashes - U.S. House report
2020_09_16_5	Exclusive: U.S. pushes arms sales surge to Taiwan, needling China - sources
2020_09_16_6	Exclusive: Top Huawei executives had close ties to company at center of U.S. criminal case
2020_09_16_7	Twenty-nine German police suspended for sharing pictures of Hitler
2020_09_16_8	Belarus leader Lukashenko disparages protests as US plan
2020_09_16_9	Canada's ethics czar says former envoy to Washington broke conflict-of-interest law in his work for Palantir
2020_02_09_0	Soldier kills 29 people in Thailand before being shot
2020_02_09_1	Insider attack in Afghanistan kills two U.S. soldiers and Afghan serviceman
2020_02_09_2	Amid tension with U.S., Iran plans satellite launch and unveils new missile
2020_02_09_3	Feds seek delay in Michael Flynn case
2020_02_20_0	Gunman suspected of deadly shootings found dead - German police
2020_02_20_1	Trump offered to pardon Assange if he denied Russia helped leak Democrats' emails - lawyer
2020_02_20_2	Bloomberg comes under scathing attack at first Democratic presidential debate in Nevada
2020_02_20_3	Kenya's Safaricom to consider Huawei as supplier for 5G network
2020_02_20_4	Two passengers from coronavirus-hit cruise ship in Japan die, authorities defend quarantine
2020_02_20_5	Former Mexico President Pena Nieto investigated in corruption probe: report
2020_02_20_6	MGM Resorts says was victim of data breach last year
2020_02_20_7	Stone sentenced to 3-1/3 years, Trump signals no immediate pardon for adviser
2020_02_20_8	IMF begins visit as Lebanon grapples with financial crisis
2020_02_20_9	Clashes, jeers and burning tires greet coronavirus evacuees in Ukraine
2020_02_20_10	Summit standoff as EU leaders grapple with Brexit-sized hole in budget
2020_02_20_11	Georgia, backed by U.S. and Britain, blames Russia for 'paralyzing' cyber attack
2020_02_01_0	Senate rejects witnesses in Trump impeachment trial, clearing way for acquittal
2020_02_01_1	U.S. declares coronavirus health emergency, bars foreign nationals who visited China
2020_02_01_2	Alleged leader of Iraqi al Qaeda group arrested in Arizona
2020_02_01_3	Abbas threatens to cut security ties with Israel, US
2020_09_09_0	Pause in AstraZeneca vaccine trial not necessarily a setback, says UK health minister
2020_09_09_1	More than 100 UK lawmakers condemn China over Uighurs abuse
2020_09_09_2	Barr backs U.S. move to defend Trump against rape accuser's defamation lawsuit
2020_09_09_3	Palestinians win Saudi support but no Arab condemnation of UAE-Israel deal
2020_09_09_4	Japan's Suga vows to put growth ahead of fiscal reform, stay course on Abenomics
2020_09_09_5	United States formally announces troop reduction in Iraq
2020_09_09_6	Sri Lankan navy tows stricken tanker away from coast, Indian plane sprays trailing slick
2020_09_09_8	Roadside bomb attack misses Afghan vice president, but kills 10
2020_09_09_9	Poland calls on Germany to halt Nord Stream 2 amid Navalny case
2020_09_09_10	LVMH taps Dior's Jones for women's designs at Fendi
2020_09_09_11	Norwegian lawmaker nominates Trump for Nobel Peace Prize
2020_09_09_12	Exclusive: Russian government tells state banks to ensure liquidity flow to Belarus lenders
2020_09_09_13	Trump said he knew virus was deadly but still played down crisis: Woodward book
2020_09_09_14	U.S. intelligence official told to halt Russian 2020 election meddling threat assessments: whistleblower
2021_01_02_0	Iran tells IAEA it plans to enrich uranium to up to 20% at Fordow site
2021_01_02_1	Afghan journalist shot dead in car ambush
2021_01_02_4	Japan to consider new COVID-19 emergency declaration
2020_02_07_0	U.S. kills al Qaeda in Arabian Peninsula leader in Yemen - Trump
2020_02_07_1	Accused El Paso mass shooter charged with 90 counts of federal hate crimes
2020_02_07_2	Credit Suisse CEO Thiam toppled by espionage scandal
2020_02_07_3	To counter Huawei, U.S. could take 'controlling stake' in Ericsson, Nokia: attorney general
2020_02_07_4	Brazilian judge delays 'for now' decision on indictment of U.S. journalist Greenwald
2020_02_07_5	Two days after his acquittal, Trump ousts two star impeachment witnesses
2020_02_07_6	Passenger plane makes emergency landing to avoid coming under Syrian fire: Russia
2020_02_07_7	Trump says 'great discipline' in China to tackle coronavirus outbreak
2020_02_07_8	Lifeblood of Amazon merchants threatened as coronavirus infects Chinese workers
2020_02_10_0	Trump slashes foreign aid, cuts safety net programs in new budget proposal
2020_02_10_1	Oil drops to 13-month low on weak Chinese demand, traders eye OPEC+ cuts
2020_02_10_2	UPDATE 3-Taiwan scrambles armed jets as Chinese air force flies around island
2020_02_10_3	Turkish forces strike back after five soldiers killed in Syria
2020_02_10_4	Merkel protegee gives up chancellery ambitions after far-right scandal
2020_02_10_5	U.S. charges four Chinese military hackers in 2017 Equifax breach
2020_02_10_6	Judge cancels Michael Flynn sentencing
2020_01_07_0	Senate Republicans close ranks on rules for Trump impeachment trial
2020_01_07_1	Germany cuts troop numbers in Iraq after Soleimani killing
2020_01_07_2	France, US set two-week target for resolving digital tax spat
2020_01_07_3	Stampede during funeral for Iranian commander kills 32: report
2020_01_07_4	Boeing changes stance, recommends 737 MAX simulator training for pilots
2020_01_07_5	Kosovo arrests Iran supporter over comments after Soleimani's death
2020_04_03_0	Pakistan re-arrests four men acquitted in Daniel Pearl murder case
2020_04_03_1	Google data shines light on whether coronavirus lockdowns worldwide are working
2020_04_03_2	OPEC+ debates biggest-ever oil cut, awaits U.S. efforts
2020_04_03_3	3M warns against Trump's order to limit face mask exports
2020_04_03_4	UPDATE 1-Putin says Russia agrees on oil output cuts, blames Saudis for low prices
2020_04_03_5	U.S. warns airlines to quickly refund tickets after canceled flights
2020_09_30_0	Azerbaijan and Armenia reject talks as Karabakh conflict zone spreads
2020_09_30_1	Norway reaches fisheries agreement with UK ahead of Brexit
2020_09_30_2	Germany finds two more swine fever cases, one in new area
2020_09_30_3	Court acquits Hindu nationalist leaders in Babri mosque demolition case
2020_09_30_4	Threat to evacuate U.S. diplomats from Iraq raises fear of war
2020_09_30_5	EU slams Poland, Hungary as cash-for-democracy fight heats up
2020_09_30_6	Northern California wildfire death toll rises to four as crews scramble to beat winds
2020_09_30_7	Ex-FBI Director Comey defends FBI Russia probe in Senate hearing
2020_09_30_8	Man charged in shooting of 2 Los Angeles County deputies
2020_09_30_9	U.S. lawmakers hammer Pentagon over lack of detail on Germany troop cuts
2020_08_16_0	Battling protests, Lukashenko says Putin agreed to help security of Belarus
2020_08_16_1	Protesters pack Belarus capital, Russia says military help available
2020_08_16_2	Japanese ship involved in Mauritius oil spill breaks apart
2020_08_16_4	At least seven dead after gunmen attack Mogadishu hotel
2020_03_04_0	Trump campaign sues Washington Post over opinion pieces, after suing NY Times
2020_03_04_1	U.S. carries out air strike on Taliban, calls for halt to 'needless attacks'
2020_03_04_2	EU pledges aid to Greece as migrants mass on border with Turkey
2020_03_04_3	Malaysia's new prime minister delays parliament session by two months
2020_03_04_4	Researchers identify two coronavirus strains as China cases dwindle
2020_03_04_5	How an ill-timed bet on a U.S. oil refinery cost ICBCS millions
2020_03_04_6	Singaporean defeats Chinese candidate to head U.N. patent office
2020_03_04_7	Work paused at F-35 jet assembly facility in Japan due to coronavirus, Pentagon says
2020_03_04_8	U.S. Defense linguist charged with transmitting classified intelligence
2020_03_04_9	United Airlines, JetBlue cut flights, spending as coronavirus hits demand
2020_04_13_0	Six killed as severe storms, tornadoes rip through U.S. South
2020_04_13_1	Exclusive: South Korea set to ship coronavirus testing kits to U.S. - source
2020_04_13_2	'God is with us': Many Muslims in Pakistan flout the coronavirus ban in mosques
2019_12_28_0	Russia says it has deployed first hypersonic nuclear-capable missiles
2019_12_28_1	Remains of six recovered from Hawaii helicopter crash, no sign of survivors
2019_12_28_2	Facing blowback, Biden clarifies stance on impeachment trial testimony
2019_12_28_3	Truck bomb kills at least 90 in Mogadishu - international organisation
2020_12_10_0	Senate sinks Dem-led effort to block Trump’s arms sales to UAE
2020_12_10_1	Probe of Biden's son places new scrutiny on U.S. attorney general pick
2020_12_10_2	Justice Department’s interest in Hunter Biden covered more than taxes
2020_12_10_3	Maduro allies win 91% of Venezuela congress seats after disputed vote
2020_12_10_4	Border official warned Canadian police not to use phone passcodes, Huawei court hears
2020_12_10_5	North Korea wasted chance to improve relations under Trump, U.S. envoy says
2020_12_10_6	Israel, Morocco to normalize ties; US shifts W Sahara policy
2020_01_25_0	Iraqi security forces raid protest camps after Sadr supporters withdraw
2020_01_25_1	Defence at Senate trial says ousting Trump would be 'massive interference' in election
2020_01_25_2	Poll: Sanders leads field in Iowa
2020_01_25_3	Iran has capacity to enrich uranium at any percentage: nuclear agency
2020_10_27_0	U.S. warns of threat posed by China, signs military pact with India
2020_10_27_1	Turkish leader backs boycott of French goods over cartoon row
2020_11_21_0	Suspect at large after multiple people wounded in Wisconsin mall shooting
2020_11_21_1	Michigan Republicans, after meeting Trump, say no information to change election outcome
2020_11_21_2	Rockets hit Afghan capital Kabul, at least eight killed
2020_11_21_3	Britain and Canada agree post-Brexit rollover trade deal
2020_11_21_4	Portugal to ban domestic travel, close schools around national holidays
2020_12_13_0	Leaders to push Brexit trade talks beyond Sunday deadline
2020_12_13_1	Iran jails British-Iranian researcher for 9 years for subversion - report
2020_03_24_0	Mnuchin hopes deal is 'very close' on $2-trillion coronavirus aid package in U.S. Senate
2020_03_24_1	U.S. to reduce Afghan aid by $1 billion after Pompeo fails to break impasse
2020_03_24_2	U.S. newspapers call on China to reverse expulsion of journalists
2020_03_24_3	Judge rejects ex-Trump lawyer Cohen's bid for freedom, even with COVID-19 risk
2020_07_02_0	Turkish court weighs bid to turn Hagia Sophia into a mosque
2020_07_02_1	Hong Kong police arrest stabbing suspect, Pence slams China's 'betrayal' of 1997 deal
2020_07_02_2	Exclusive: Hong Kong activists discuss 'parliament-in-exile' after China crackdown
2020_07_02_3	Fed's Bullard warns of financial crisis risks as virus cases spike: FT
2020_07_02_4	Britain recognises Guaido as Venezuela's president in gold dispute, judge rules
2020_07_02_5	Vietnam, Philippines denounce China military drills in disputed waters
2020_07_02_6	Jeffrey Epstein friend Ghislaine Maxwell arrested on sex abuse charges
2020_07_02_7	U.S. Supreme Court takes up Trump bid to withhold parts of Russia report
2020_07_02_8	Unions urge Airbus to slow down restructuring plans
2020_07_02_9	U.S. Senator to block military promotions until assurances on former White House aide
2020_12_02_2	Iran’s parliament approves bill to stop nuclear inspections
2020_12_02_3	EU criticises 'hasty' UK approval of COVID-19 vaccine
2020_12_02_4	Key Hong Kong activists jailed over police HQ protest
2020_12_02_5	China successfully lands spacecraft on moon to retrieve lunar rocks
2020_12_02_6	Afghan government, Taliban reach breakthrough deal as calls grow for a ceasefire
2020_12_02_7	OAS head urges international prosecutor to act on Venezuela
2020_10_28_0	Qatar expresses regret as Australia says women on 10 flights searched
2020_03_25_0	Pompeo says China still withholding coronavirus information
2020_03_25_1	Libya battles escalate as coronavirus arrives in country
2020_03_25_2	China lifting last controls in province at outbreak’s center
2020_03_25_3	‘I am so happy I can barely speak’: Trump whacks Romney after negative coronavirus test
2020_03_25_4	World Bank, IMF urge debt relief for poorest countries
2020_04_23_0	Guards chief: U.S. warships will be destroyed if they threaten Iran in Gulf
2020_04_23_1	Malaysia calls for peaceful end to months-long South China Sea standoff
2020_04_23_2	PM was like 'any other patient', say nurses who treated him for coronavirus
2020_04_23_3	Iran, like wider Mideast, relies on deliveries amid pandemic
2020_04_23_4	Germany at odds with Apple on smartphone coronavirus contact tracing
2020_04_23_5	Naomi Campbell - from catwalk queen to chat show host
2020_07_30_0	Hong Kong police arrest four under new security law in move slammed by rights group
2020_07_30_1	U.S. to withdraw about 12,000 troops from Germany but nearly half to stay in Europe
2020_07_30_2	U.S. Supreme Court Justice Ginsburg undergoes bile duct procedure in New York hospital
2020_07_30_3	NASA launches new rover to search for signs of past Martian life
2020_07_30_4	Belarus summons Russian envoy after detaining suspected mercenaries - RIA
2020_07_30_5	U.S. urges Pakistan to act after American charged with blasphemy shot in court
2020_07_30_6	Pompeo says threats to US in Afghanistan raised with Russia
2020_07_30_7	Republican lawmakers reject Trump suggestion to delay U.S. election
2020_07_30_8	Case of ex-Trump aide Flynn to be reheard by full U.S. appeals court
2020_07_30_10	Obama calls for end of 'Jim Crow relic' filibuster if it blocks voting reforms
2020_05_11_0	Pence not in quarantine, to be at White House Monday, after aide tests positive for coronavirus
2020_05_11_1	Georgia AG seeks federal probe of jogger’s death
2020_05_11_2	Iran says missile kills 19 sailors in training accident
2020_05_11_3	ANALYSIS-As U.S. meat workers fall sick and supplies dwindle, exports to China soar
2020_05_11_4	Hong Kong police arrest more than 200 as pro-democracy protests return
2020_05_11_5	WHO says has 'no mandate' to invite Taiwan to assembly meeting
2020_05_11_6	Justice Department weighs hate crime charges in death of Ahmaud Arbery
2020_05_11_7	Tesla's Musk says ready for arrest as he reopens California plant against local order
2020_04_26_0	White House considering replacing HHS chief Azar - reports
2020_04_26_1	Netanyahu 'confident' U.S. will allow West Bank annexation in two months
2020_11_10_0	Armenia, Azerbaijan, Russia say sign deal to end Nagorno-Karabakh conflict
2020_11_10_1	Europe charges Amazon with using dominance and data to squeeze rivals
2020_08_09_0	UK PM orders PR campaign for schools to reopen in September - Sunday Times
2020_08_09_1	Protests erupt after tainted election in Belarus
2020_08_09_2	Afghanistan to release 400 'hard-core' Taliban prisoners in bid for peace
2020_08_09_3	Saudi Aramco's profit plunges, sees signs of oil market recovery
2020_08_09_4	Protesters call for end to Spanish monarchy after former king's exit
2020_08_09_5	Donors pledge 253 million euros in emergency aid for Lebanon after blast
2020_08_09_6	Afghan war victims say hope for peace comes at a price: forgiveness
2020_08_09_7	Gunmen kill six French aid workers, their driver and guide in Niger, minister says
2020_02_25_0	Canadian police clear indigenous rail blockade, arrest 10
2020_02_25_1	Susan Collins breaks with Trump over Grenell
2020_02_25_2	Chinese court jails Hong Kong bookseller for 10 years, Sweden objects
2020_02_25_3	Buttigieg wins endorsement from South Carolina newspaper
2020_02_25_4	Canaries hotel locked down over coronavirus as Spain reports first mainland cases
2020_02_25_5	Trump: No election help wanted or received from any country
2020_02_25_6	Trump administration in talks about Chevron's operations in Venezuela: envoy
2020_02_25_7	2 Florida Democrats sue to keep Sanders off primary ballot
2020_02_25_8	Federal judge rebukes Trump over Stone jury comments
2020_02_25_9	Walt Disney's Iger steps down as CEO, parks head Chapek to take reins
2020_03_06_0	Judge slams Barr, orders review of Mueller report deletions
2020_03_06_1	JPMorgan CEO Jamie Dimon recovering after emergency heart surgery
2020_03_06_2	OPEC raises stakes with Russia, seeks biggest oil cut since 2008 crisis
2020_03_06_3	NZ man with coronavirus attended packed rock concert in Auckland, health authorities say
2020_03_06_4	Romney says U.S. Senate Republican probe of Biden appears political
2020_03_06_5	Erdogan says military posts in Syria's Idlib will stand after ceasefire
2020_03_06_6	Malaysia anti-graft chief who probed 1MDB scandal quits
2020_03_06_7	Guyana's Granger claims victory as U.S. and EU question vote results
2020_03_06_8	Grindr's Chinese owner says to sell social media app for $608 mln
2020_03_06_9	Islamic State attacks Kabul gathering, killing at least 32
2020_03_06_10	Dutch MH17 trial to start without Russian, Ukrainian suspects
2020_03_06_11	Blast outside U.S. Embassy in Tunisia kills policeman
2020_03_06_12	House panel seeks rehearing over White House counsel subpoena fight
2019_12_16_0	U.S. Senate's Schumer wants Mulvaney, Bolton, others to testify in impeachment trial
2019_12_16_1	Militants kill 22 in eastern Congo despite claims of security progress
2019_12_16_2	China's Xi vows support for Hong Kong leader during 'most difficult' time
2019_12_16_3	U.S. envoy Biegun urges North Korea to respond to calls for talks
2019_12_16_4	India citizenship law protests spread across campuses
2019_12_16_5	Amnesty says 304 killed in Iran unrest, thousands arrested including children
2019_12_16_6	EU tells Malta to hasten push for independent judges, prosecutors
2019_12_16_7	Democrats lay out case for Wednesday Trump impeachment vote
2019_12_16_8	Judge rejects claims by Trump ex-adviser Flynn of FBI misconduct
2020_01_29_0	WHO to reconsider declaring global emergency as China virus evacuations begin
2020_01_29_1	As vote on witnesses looms, Trump legal team tells impeachment trial: 'Time for this to end'
2020_01_29_2	White House holds off on suspending China-U.S. flights amid virus outbreak
2020_01_29_3	Citing Trump plan, Israel defense chief backs extending sovereignty to West Bank settlements
2020_01_29_4	Factbox: Huawei's involvement in other countries' telecoms networks
2020_01_29_5	U.S. says 50 troops now diagnosed with traumatic brain injury after Iran strike
2020_01_29_6	Maryland policeman charged with murder in shooting of handcuffed man
2020_01_29_7	Pompeo to Britain: Look again at Huawei 5G decision
2020_01_29_8	Chinese family in UAE diagnosed as first virus cases in Middle East
2020_01_29_9	Australia scientists to share lab-grown coronavirus to hasten vaccine efforts
2020_01_29_10	British Airways, Iberia suspend direct flights to mainland China amid virus fears
2020_01_29_11	For airlines, China boom now exposes them to risk as coronavirus slams market
2020_01_29_12	L Brands CEO in talks to step aside and sell Victoria's Secret: WSJ
2020_01_29_13	White House tells Bolton his manuscript contains classified material, cannot be published
2020_06_16_0	Trump says ex-adviser Bolton will break the law if he publishes book
2020_06_16_1	U.S., China to each allow four weekly flights for airlines; Delta to fly next week
2020_06_16_2	North Korea destroys inter-Korean liaison office in 'terrific explosion'
2020_06_16_3	New Zealand no longer free of coronavirus as two women test positive
2020_06_16_4	Ukraine president's wife hospitalized with moderate COVID-19
2020_06_16_5	India, China troops clash at Himalayan border, 'casualties on both sides'
2020_06_16_6	Britain warns at UN rights forum against security law for Hong Kong
2020_06_16_7	Warren endorses Jamaal Bowman over Eliot Engel in show of progressive support
2020_06_16_8	U.S. Justice Dept. employees to testify about political meddling, House panel says
2020_06_16_9	Google penalizes right-wing sites over 'derogatory content'
2020_10_23_0	Sudan becomes third Arab state to set aside hostilities with Israel this year
2020_03_12_0	Sanders vows to remain in White House race despite more losses to Biden
2020_03_12_1	Kazakhstan suspends all public events over coronavirus
2020_03_12_2	Pentagon chief says all options on table after Iraq rocket attack
2020_03_12_3	Senate bill would ban TikTok on federal employees' work phones
2020_03_12_4	EU disapproves of U.S. travel ban, 'taken unilaterally and without consultation'
2020_03_12_5	Exclusive: Sinclair Oil weighs offers for company sale - sources
2020_03_12_6	Trump says not concerned he was exposed to coronavirus by Brazilian official
2020_03_12_7	Apple signs multi-year deals with major music labels: Financial Times
2020_11_11_0	Hong Kong pro-democracy lawmakers to resign as Beijing moves to quash opposition
2020_11_11_1	Suicide halts Brazil trial of Chinese vaccine attacked by Bolsonaro
2020_11_11_2	Syria's Assad says U.S. pressure, sanctions obstructing return of refugees
2020_11_11_3	After McCarrick report, pope vows to 'uproot evil' of clerical sexual abuse
2020_11_11_4	France says ”cowardly” Remembrance Day attack in Saudi city Jeddah wounds several
2020_11_11_5	Sullivan wins re-election in Alaska, taking U.S. Senate battle down to Georgia
2019_12_30_0	Iraq condemns U.S. air strikes as unacceptable and dangerous
2019_12_30_1	Texas church shooter wore wig and fake beard, says security head who shot him
2019_12_30_2	North Korea's Kim urges 'positive and offensive' security measures ahead of nuclear talks deadline
2019_12_30_3	Trump briefed by top aides on 'successful' U.S. airstrikes in Iraq, Syria
2019_12_30_4	Prominent Chinese pastor gets nine years in jail for subversion
2019_12_30_5	Cyprus court finds Briton guilty of lying about gang-rape
2019_12_30_6	White House adviser says China trade deal signing expected soon
